{
  "schema_version": "0.1.0",
  "spec_id": "spec-86b65907-a49e-4383-b964-06d2d5f22151",
  "process_id": "86b65907-a49e-4383-b964-06d2d5f22151",
  "estate_ref": {
    "path": "artifacts/estate/estate.json",
    "sha256": "040a1a59dd7e0dd2ad45b786124ef6879c1c0bdffacd3a1c95f998c7a0949795"
  },
  "status": "approved",
  "created_at": "2026-07-21T00:48:53.185168+00:00",
  "extraction": {
    "provider": "anthropic",
    "model": "claude-sonnet-5",
    "prompt_version": "0.1.0"
  },
  "purpose": {
    "text": "This process performs a daily settlement reconciliation by retrieving a bank's settlement transactions, summing their amounts, and comparing the resulting total against an expected total supplied at the start of the run. If the difference (variance) falls within an acceptable tolerance, the process ends normally reporting the totals; if the variance falls outside tolerance, the process raises a case for investigation and throws a business exception to flag the discrepancy for follow-up.",
    "citations": [
      "01f1920a-88a4-4e29-bd04-221d5ecc55ef",
      "1ce83645-ef19-45b0-aba7-d0272940942e",
      "a9b0960b-c81c-4dbe-b2c1-dbc046052940",
      "a16769bb-fa39-4a02-8e1e-19d9e21d49d7",
      "1109d39b-3f51-4829-b70c-d90e473404b8"
    ]
  },
  "inputs": [
    {
      "name": "ExpectedTotal",
      "description": "The expected settlement total for the account/period being reconciled, provided by the calling context.",
      "source": "Process Start stage input",
      "citations": [
        "01f1920a-88a4-4e29-bd04-221d5ecc55ef"
      ]
    },
    {
      "name": "Tolerance",
      "description": "The acceptable margin of error between the actual running total and the expected total, defaulted to 25.",
      "source": "Process data item with initial value",
      "citations": [
        "a16769bb-fa39-4a02-8e1e-19d9e21d49d7"
      ]
    },
    {
      "name": "Settlement Transactions",
      "description": "Transaction rows for the account/date range retrieved from the core banking system to be summed for reconciliation.",
      "source": "MFG Core Banking object, Get Transactions action",
      "citations": [
        "1ce83645-ef19-45b0-aba7-d0272940942e"
      ]
    }
  ],
  "outputs": [
    {
      "name": "RunningTotal",
      "description": "The accumulated sum of all transaction amounts retrieved for the reconciliation period.",
      "destination": "Process End stage output",
      "citations": [
        "eec3b889-c5a0-4f5d-9c28-7a1cf95c33b6",
        "1109d39b-3f51-4829-b70c-d90e473404b8"
      ]
    },
    {
      "name": "RowCount",
      "description": "The count of transaction rows processed during reconciliation.",
      "destination": "Process End stage output",
      "citations": [
        "6f8a2455-2f21-4964-9406-90a33a544e47",
        "1109d39b-3f51-4829-b70c-d90e473404b8"
      ]
    },
    {
      "name": "CaseId",
      "description": "Identifier of the variance investigation case created when reconciliation fails.",
      "destination": "MFG Case Manager object, Create Case action",
      "citations": [
        "c0dc862e-4fe2-4411-9c35-3e66bb29a879"
      ]
    }
  ],
  "business_rules": [
    {
      "id": "BR-1",
      "statement": "The variance between the running total of transactions and the expected total must fall within +/- the configured tolerance for reconciliation to pass.",
      "citations": [
        "a16769bb-fa39-4a02-8e1e-19d9e21d49d7"
      ]
    },
    {
      "id": "BR-2",
      "statement": "When the variance is outside tolerance, a Settlement Variance case must be created before the process reports failure.",
      "citations": [
        "c0dc862e-4fe2-4411-9c35-3e66bb29a879"
      ]
    },
    {
      "id": "BR-3",
      "statement": "When the variance is outside tolerance, the process must raise a Business Exception rather than complete normally.",
      "citations": [
        "91b7d971-283c-4b24-aecb-3541077f4b74"
      ]
    }
  ],
  "exception_semantics": [
    {
      "condition": "The computed variance between running total and expected total is outside the defined tolerance range.",
      "current_handling": "The process creates a 'Settlement Variance' case via the MFG Case Manager object and then throws a Business Exception with details of the variance.",
      "citations": [
        "a16769bb-fa39-4a02-8e1e-19d9e21d49d7",
        "c0dc862e-4fe2-4411-9c35-3e66bb29a879",
        "91b7d971-283c-4b24-aecb-3541077f4b74"
      ]
    }
  ],
  "human_touchpoints": [
    {
      "description": "A case is created in the Case Manager system for settlement variances outside tolerance, implying a human reviewer will investigate and resolve the discrepancy.",
      "citations": [
        "c0dc862e-4fe2-4411-9c35-3e66bb29a879"
      ]
    }
  ],
  "approval": {
    "approved_by": "Chris Williams",
    "approved_at": "2026-07-21T01:09:16.909254+00:00",
    "changes": []
  }
}
